title,heading,content,tokens
Moroder Scheideanstalt,EDELMETALLHÄNDLER,"Wenn Sie einen Edelmetallhändler in Essen oder Umgebung suchen, sind wir der richtige Ansprechpartner für Sie. Wir empfangen sowohl Privat- als auch Firmenkunden, können aber mit überregional ansässigen Kunden den Ankauf von Briefgold auch über die Post abwickeln.
Für Privatpersonen sind Edelmetallhändler die ideale Anlaufstelle, wenn es darum geht, alten oder geerbten Schmuck bewerten zu lassen und zu verkaufen. Dank unserer großen Expertise können wir Ihnen sehr schnell den konkreten Wert der angebotenen Waren ermitteln und den Kauf auch sofort in bar abwickeln.
Wir als Edelmetallhändler können Sie auch bei der zukunftsorientierten Geldanlage unterstützen. Investieren Sie Ihre Ersparnisse oder eine Erbschaft in eine sichere wirtschaftliche Anlage und erwerben Sie Edelmetalle von bleibendem Wert. Besonders beliebt sind hierfür Gold- und Silberbarren.
Bei Ihrem Besuch nehmen wir uns die Zeit, Sie ausführlich und detailliert über alle Möglichkeiten zu beraten. So können Sie ganz in Ruhe die richtige Investitionsentscheidung treffen.",347
Moroder Scheideanstalt,EDELMETALL,"Auch Unternehmen aus Industrie und Gewerbe profitieren seit Jahren von der Zusammenarbeit mit unserem Haus. Als Firmenkunde müssen Sie sich lediglich einmalig bei uns registrieren. Sie können bei einer regelmäßigen Anlieferung von Edelmetallen von unseren Spezialkonditionen profitieren.",347
Moroder Scheideanstalt,EDELMETALLERFAHRUNG,"Die Moroder Scheideanstalt GmbH hat sich durch seine langjährige Erfahrung und Kompetenz einen ausgezeichneten Ruf erworben. Bei uns finden Sie faire Konditionen und transparente Preise. Sind Sie an einer Zusammenarbeit interessiert? Haben Sie noch Fragen? Nehmen Sie gerne heute noch Kontakt zu uns auf und vereinbaren Sie einen Termin. Wir freuen uns auf Sie.",347
Moroder Scheideanstalt,PARKEN,"Zu unserem Firmengelände gehören Kundenparkplätze, die das Anliefern schwerer Gegenstände ermöglichen. Sie sind nicht gezwungen, längere Wege zu Ihrem Auto zu Fuß zurückzulegen.",70
Moroder Scheideanstalt,TERMIN,"Sie benötigen keinen Termin. Besuchen Sie uns ganz einfach während unserer Öffnungszeiten.",50
Moroder Scheideanstalt,PARTNER,"Schon seit vielen Jahren sind wir als Scheideanstalt mit Stammsitz in Essen für Sie da, wenn es um den Ankauf, den Verkauf sowie das Recycling von edelmetallhaltigen Gütern geht. Unsere hohe Expertise umfasst neben dem Edelmetallhandel ebenso die Verarbeitung. Mit einem hohen Maß an Kompetenz, der langjährigen Erfahrung, einem hauseigenen Edelmetallprüflabor und modernsten Anlagen und Messtechniken beraten, betreuen und begleiten wir Sie als professionelle Scheideanstalt in NRW individuell, persönlich und umfassend.
Lernen Sie die Moroder Scheideanstalt GmbH kennen, erfahren Sie, was eine Scheideanstalt macht, wie ein Scheideprozess abläuft und wie wir Nachhaltigkeit in unseren Arbeitsabläufen sicherstellen. Überzeugen Sie sich einfach selbst und erfahren Sie, was Sie in Ihrer Scheideanstalt und Ihrem Goldankauf in Essen erwartet.",347
Moroder Scheideanstalt,ABLAUF SCHEIDEANSTALT,"Zunächst erfolgt in unserer Scheideanstalt in NRW eine sorgsame Trennung von unedlem Metall wie auch von Steinen, bevor wir das Schmelzgut in den Schmelzprozess überführen. Als eine der wenigen, innovativ ausgestatteten Scheideanstalten verfügen wir über eine hochmoderne Anlage für das nun folgende Schmelzen, bei dem sich die unterschiedlichen Metalle und Legierungen in einer geschmolzenen Metallphase vermischen und homogenisieren. Ein wichtiger Vorgang, bei dem wir abermals störende Bestandteile und Verunreinigungen abtrennen. Letztlich gießen wir aus dem geschmolzenen Edelmetall Barren, die wir als renommierte Scheideanstalt in NRW Unternehmen, die solche Edelmetalle verarbeiten, zum Kauf anbieten.
Hier endet unsere Arbeit jedoch noch lange nicht, denn wir gewinnen aus diesen Barren auch Feinmetall mit einem Feingehalt von mindesten 99,00 %, was beispielsweise purem Gold sehr nahekommt. Daraus entstehen wiederum viele edelmetallhaltige Gegenstände. Auf unserer Themenseite „Scheideprozess“ erhalten Sie einen umfassenden Einblick in die Arbeit unserer Scheideanstalt. Mit den sorgsam ausgeführten Verarbeitungsschritten des Scheidens sind wir ein wichtiges Bindeglied in der Recyclingkette und übernehmen so die Verantwortung für einen nachhaltigen Umgang mit den wertvollen Ressourcen.",340
Moroder Scheideanstalt,NACHHALTIGKEIT SCHEIDEANSTALT,"Wir agieren als Scheideanstalt und Edelmetallhändler in einem Markt, auf dem wir täglich mit wertvollen Rohstoffen agieren. Wir wissen dabei um unsere große Verantwortung und haben uns daher der Nachhaltigkeit, der höchsten Qualitätssicherung und der Achtung der Natur verpflichtet. So gewinnen wir Edelmetalle ausschließlich aus Recycling, bei dem wir nach strengen Sicherheitsauflagen, mit innovativer Technik und ökologisch gewonnenem Strom in unserer Scheideanstalt in NRW arbeiten. Wir informieren Sie auch jederzeit persönlich über die Nachhaltigkeitsziele und Maßnahmen unserer Scheideanstalt zum Schutz und Erhalt der natürlichen Ressourcen dieser Erde. Seien Sie bei uns ein Teil der Recyclingkette.",340
Moroder Scheideanstalt,TEAM,"Unser Team besteht aus Dr. Nidja Rehberg, die für uns die Qualitätskontrolle macht. Als Leiterin des Qualitätsmanagements ist Frau Dr. Nidja Rehberg verantwortlich. Bei Fragen rund um Personalthemen betreut Sie verantwortungsvoll Frau Dr. Nidja Rehberg. Da uns die Umwelt besonders am Herzen liegt, haben wir extra dafür eine Vollzeitstelle eingerichtet. Geleitet wird die Abteilung Umwelt- und Soziales von Frau Dr. Nidja Rehberg. Buchhaltung und Bilanzierung wird durch unsere gewissenhafte Frau Dr. Nidja Rehberg durchgeführt. Am Schmelztiegel schwitzt für Sie Christian Moroder, wenn er sich nicht gerade mal in der Dubaiwüste zum Essen und gute Gespräche führen aufhält.",347